{
  "capability": {
    "mode": "effect",
    "name": "change.open",
    "version": 1
  },
  "connector_id": "ssc_22222222222222222222222222222222",
  "connector_protocol_version": 1,
  "deadline": "2026-10-18T18:00:00.000000+00:00",
  "deployment_sha256": "aaaaaaaaaaaaaaaaaaaaaaaaaaaaaaaaaaaaaaaaaaaaaaaaaaaaaaaaaaaaaaaa",
  "error_code": null,
  "input_sha256": "aa08035edfe94a255382f87a0c838b1f80598a418df4b5999db428511142e84d",
  "mapping": {
    "account": "automation",
    "credential_scope_sha256": "bbbbbbbbbbbbbbbbbbbbbbbbbbbbbbbbbbbbbbbbbbbbbbbbbbbbbbbbbbbbbbbb",
    "host": "forge.example.test",
    "name": "primary",
    "repository": "acme/widgets",
    "service": "example-forge"
  },
  "operation_id": "sop_11111111111111111111111111111111",
  "outcome": "succeeded",
  "phase": "invoke",
  "provider_status": 201,
  "receipt": {
    "closed_references": [],
    "evidence_sha256": "eeeeeeeeeeeeeeeeeeeeeeeeeeeeeeeeeeeeeeeeeeeeeeeeeeeeeeeeeeeeeeee",
    "observed_revision": "dddddddddddddddddddddddddddddddddddddddd",
    "remote_identity": "change-42"
  },
  "request_bytes": 512,
  "request_limit_bytes": 16384,
  "response_bytes": 128,
  "response_limit_bytes": 32768,
  "retry_after_seconds": null,
  "schema_version": 1
}
